{
  "$schema": "https://json-schema.org/draft/2020-12/schema",
  "$id": "https://godotgs.local/.agentic/schemas/task.schema.json",
  "title": "Agentic Task Contract",
  "description": "A small, explicit specification for one unit of agent work. One contract -> one branch -> one worktree.",
  "type": "object",
  "additionalProperties": false,
  "required": [
    "schema_version",
    "task_id",
    "github_issue",
    "title",
    "baseline_sha",
    "risk_class",
    "owned_paths",
    "forbidden_paths",
    "dependencies",
    "problem_statement",
    "non_goals",
    "invariants",
    "acceptance_criteria",
    "validation_commands",
    "evidence_requirements",
    "rollback_plan"
  ],
  "properties": {
    "schema_version": { "type": "integer", "const": 1 },
    "task_id": { "type": "string", "description": "Stable identifier, e.g. GS-298." },
    "github_issue": { "type": "string", "description": "Issue reference or URL, e.g. #298." },
    "title": { "type": "string" },
    "baseline_sha": { "type": "string", "description": "Immutable base commit the work starts from." },
    "risk_class": { "type": "string", "enum": ["R0", "R1", "R2", "R3"] },
    "owned_paths": { "type": "array", "items": { "type": "string" } },
    "forbidden_paths": { "type": "array", "items": { "type": "string" } },
    "dependencies": {
      "type": "array",
      "description": "Other task_ids or PRs this work depends on; empty if none.",
      "items": { "type": "string" }
    },
    "problem_statement": { "type": "string" },
    "non_goals": { "type": "array", "items": { "type": "string" } },
    "invariants": { "type": "array", "items": { "type": "string" } },
    "acceptance_criteria": { "type": "array", "items": { "type": "string" } },
    "validation_commands": { "type": "array", "items": { "type": "string" } },
    "evidence_requirements": { "type": "array", "items": { "type": "string" } },
    "rollback_plan": { "type": "string" },
    "design_record": {
      "type": "string",
      "description": "Link to the ADR / design-change issue. Required for risk classes whose policy sets adr_required (R3)."
    },
    "stacked_on": {
      "type": "object",
      "description": "Optional: present only for stacked work.",
      "additionalProperties": false,
      "properties": {
        "base_pr": { "type": "string" },
        "base_sha": { "type": "string" }
      }
    }
  }
}
